<?xml version="1.0" encoding="UTF-8" ?>
<persons xmlns:xsi="http://www.w3.org/2001/XMLSchema-instance"
        xmlns="http://it-academy.by/jd2018-11-13/akhmelev"
         xsi:schemaLocation="http://it-academy.by/jd2018-11-13/akhmelev person.xsd"
>
    <person>
        <email>vasya@mail.ru</email>
        <nickname>Vasya</nickname>
        <password>Vasya1980</password>
        <ads>
            <ad>
                <description>Шикарный нумер You&amp;I</description>
                <address>Минск Ленина 1 71</address>
                <rooms>3</rooms>
                <floor>3</floor>
                <floors>5</floors>
                <area>55.5</area>
                <price>77777</price>
            </ad>
            <ad>
                <description>Убитый нумер </description>
                <address>Минск Жожская 1 1</address>
                <floor>1</floor>
                <rooms>1</rooms>
                <floors>1</floors>
                <area>25.5</area>
                <price currency="$">37777</price>
            </ad>
        </ads>
    </person>
</persons>